[
  {
    "id": "vision-language-action-loop",
    "name": "Vision-Language-Action Loop",
    "category": "Technology & Engineering",
    "hierarchyTypes": ["pipeline"],
    "tags": ["multi-modal", "embodied", "gui-automation", "vision", "continuous-loop", "documented"],
    "summary": "An agent perceives through vision, reasons through language, and acts through UI automation in a continuous loop.",
    "description": "The agent operates in a tight perception-reasoning-action cycle: it observes the environment through screenshots or camera feeds, reasons about the current state using a vision-language model, selects and executes an action (click, keystroke, API call), then observes the result. The loop runs continuously until the task is complete or the agent gets stuck and escalates. The key challenge is grounding -- the model must accurately map visual observations to actionable understanding of UI state, including detecting when an action succeeded or failed.",
    "realWorldExample": "Anthropic's computer use feature lets Claude see screenshots and control mouse/keyboard to complete tasks on a desktop. Google's Project Mariner navigates web pages visually. Apple Intelligence uses on-screen context to understand and act on what the user sees. UI-TARS (ByteDance) and CogAgent (Tsinghua) are open-source vision-language-action models for GUI agents. These systems share the same core loop: screenshot → reason → act → screenshot.",
    "whenToUse": "When the agent must interact with systems that have no API -- legacy desktop apps, web UIs without stable selectors, or physical environments with camera input. Also useful when visual understanding provides richer context than DOM parsing or API responses alone.",
    "strengths": [
      "Works with any visual interface -- no API or structured access required",
      "Visual grounding provides richer context than text-only approaches (layout, color, state indicators)",
      "The continuous loop is self-correcting -- the agent sees whether its action succeeded",
      "Generalizes across applications without per-app integration work"
    ],
    "weaknesses": [
      "Screenshot-based perception is slower and more expensive than API calls",
      "Visual grounding errors (misidentifying UI elements) can cascade into wrong actions",
      "Latency of the observe-reason-act cycle limits task speed",
      "Brittle to UI changes -- screen resolution, theme, or layout shifts break learned visual patterns"
    ],
    "agents": [
      {
        "role": "perceiver",
        "name": "Visual Perceiver",
        "description": "Captures screenshots or camera frames and preprocesses them for the vision-language model. Handles screen region selection, resolution normalization, and frame timing",
        "memory": "ephemeral"
      },
      {
        "role": "reasoner",
        "name": "Language Reasoner",
        "description": "A vision-language model that interprets the current visual state, determines task progress, and selects the next action from an action space (click coordinates, keystrokes, scroll, type text)",
        "memory": "persistent-private"
      },
      {
        "role": "executor",
        "name": "Action Executor",
        "description": "Translates the reasoner's high-level action selection into concrete OS-level events (mouse moves, key presses, API calls) and confirms execution",
        "memory": "ephemeral"
      }
    ],
    "forums": [
      {
        "name": "Observation Buffer",
        "type": "queue",
        "participants": ["perceiver", "reasoner"]
      },
      {
        "name": "Action Log",
        "type": "log",
        "participants": ["reasoner", "executor"]
      }
    ],
    "memoryArchitecture": {
      "shared": [
        "Task specification -- the user's goal and any constraints",
        "Action history -- sequence of (screenshot, action, result) triples for context"
      ],
      "private": [
        "Reasoner's internal chain-of-thought about UI state and next steps"
      ],
      "description": "The perceiver and executor are stateless. The reasoner maintains a sliding window of recent observation-action pairs as working memory. Long-term task context comes from the original task specification and accumulated action history."
    },
    "diagram": "graph TD\n  T[Task Goal] --> R[Language Reasoner]\n  P[Visual Perceiver] -->|screenshot| R\n  R -->|action selection| E[Action Executor]\n  E -->|mouse/keyboard/API| ENV[Environment]\n  ENV -->|visual feedback| P\n  R -->|done?| CHECK{Task Complete?}\n  CHECK -->|no| P\n  CHECK -->|yes| OUT[Result]"
  },
  {
    "id": "multimodal-routing",
    "name": "Multimodal Routing",
    "category": "Technology & Engineering",
    "hierarchyTypes": ["orchestrated"],
    "tags": ["multi-modal", "routing", "specialist", "content-type", "dispatch", "documented"],
    "summary": "An input classifier detects modality (text, image, audio, video, code) and routes to specialist processors.",
    "description": "A dispatcher agent examines incoming requests to determine the modality mix -- text, image, audio, video, code, or combinations. It routes each modality component to a specialist processor optimized for that type. For multimodal inputs (e.g., an image with a text question), the dispatcher may invoke multiple specialists in parallel and synthesize their outputs. The pattern decouples modality-specific processing from the orchestration logic, allowing each specialist to be upgraded or swapped independently.",
    "realWorldExample": "GPT-4o processes text, images, and audio natively in one model, performing internal multimodal routing. Google Gemini handles text, images, video, and audio with unified multimodal understanding. For multi-agent systems, Semantic Kernel's magentic orchestration can route based on content type. Many production systems use a text classifier to decide whether to invoke vision, audio transcription, or code execution agents.",
    "whenToUse": "When your system must handle diverse input types and the optimal processing strategy differs by modality. Especially valuable when specialists have different cost, latency, or accuracy profiles and you want to avoid sending everything through a single expensive multimodal model.",
    "strengths": [
      "Each specialist can be independently optimized, scaled, and upgraded for its modality",
      "Cost-efficient -- simple text queries skip expensive vision or audio processing",
      "Parallel specialist invocation reduces latency for mixed-modality inputs",
      "New modalities can be added by registering a new specialist without changing the router"
    ],
    "weaknesses": [
      "The input classifier is a single point of failure -- misclassification sends input to the wrong specialist",
      "Cross-modal reasoning (questions that require understanding image AND text together) can be lost when splitting",
      "Synthesis of specialist outputs adds complexity and can lose nuance",
      "Maintaining multiple specialist models is operationally expensive"
    ],
    "agents": [
      {
        "role": "modality-classifier",
        "name": "Modality Classifier",
        "description": "Examines incoming requests to determine modality composition (text, image, audio, video, code) and routes to appropriate specialists",
        "memory": "ephemeral"
      },
      {
        "role": "text-specialist",
        "name": "Text Specialist",
        "description": "Processes text-only inputs -- summarization, QA, generation, classification",
        "memory": "ephemeral"
      },
      {
        "role": "vision-specialist",
        "name": "Vision Specialist",
        "description": "Processes image and video inputs -- captioning, object detection, visual QA, OCR",
        "memory": "ephemeral"
      },
      {
        "role": "audio-specialist",
        "name": "Audio Specialist",
        "description": "Processes audio inputs -- transcription, speaker identification, tone analysis",
        "memory": "ephemeral"
      },
      {
        "role": "synthesizer",
        "name": "Response Synthesizer",
        "description": "Combines outputs from multiple specialists into a unified response for multi-modal inputs",
        "memory": "ephemeral"
      }
    ],
    "forums": [
      {
        "name": "Input Queue",
        "type": "queue",
        "participants": ["modality-classifier"]
      },
      {
        "name": "Specialist Results",
        "type": "pub-sub",
        "participants": ["text-specialist", "vision-specialist", "audio-specialist", "synthesizer"]
      }
    ],
    "memoryArchitecture": {
      "shared": [
        "Request context -- the original user request with all modality components",
        "Specialist outputs -- intermediate results from each modality processor"
      ],
      "private": [],
      "description": "The classifier is stateless. Specialists process independently and return structured outputs. The synthesizer receives all specialist outputs and the original request context to produce a coherent response. No persistent state is needed across requests."
    },
    "diagram": "graph TD\n  IN[Input Request] --> MC[Modality Classifier]\n  MC -->|text| TS[Text Specialist]\n  MC -->|image/video| VS[Vision Specialist]\n  MC -->|audio| AS[Audio Specialist]\n  MC -->|code| CS[Code Specialist]\n  TS --> SYN[Response Synthesizer]\n  VS --> SYN\n  AS --> SYN\n  CS --> SYN\n  SYN --> OUT[Unified Response]"
  },
  {
    "id": "knowledge-graph-grounded-agent",
    "name": "Knowledge Graph-Grounded Agent",
    "category": "Technology & Engineering",
    "hierarchyTypes": ["orchestrated"],
    "tags": ["knowledge-graph", "structured-retrieval", "graph-database", "grounding", "documented"],
    "summary": "The agent reasons over a structured knowledge graph for typed relationships and consistency that flat text retrieval cannot provide.",